{"annotation_owner_role":"quality_owner","manifest_sha256":"0de369a4dee5c119197d973efa0368458f6f27651ef82fd5b9951a6d61cb6448","negative_family_count":9,"overlay_scale_percent":200,"recorded_at":"2026-07-27T08:57:47.553928Z","schema_version":"visual-symbol-annotation-verdict/1","unlabeled_target_count":0}